question;post_tag
Google Maps integration with Django [closed];django
How to load static files from separate S3 bucket when hosting site on Elastic Beanstalk Aws React Django;django
How to show total number of selected object on template after selecting object on field which have OneToMany relations with other table;django
Django clear rest api urls for function based views;django
Can we use MoneyField() field as output_field in Django Case;django
Can't get Profile object that belongs to User in django;django
how can add number to integerField in django models?;django
How to access the model class object in form_valid in django's create view?;django
Why am I getting a WinError 32 while deleting a file on django?;django
django-rest-framework – how to serialize nested objects?;django
Improperly Configured;django
Handling 404 status with SPA using Create React App and Django API backend;django
Storing and rewriting a constant variable (session key) in Django;django
I want to configure AWS S3 on my django project but many of my client's media files are on my pythonanywhere server already;django
How to add Search Index in elasticsearch document django?;django
How to serve a djangoAPI and Angular frontend in Apache;django
What type of authentication should I use for Django with Flutter?;django
how to add python in cpanel in ubantu server?;django
How to set field via m2m-changed?;django
Cookies are not set in the request header;django
Django + raw SQL query - how to juggle between a null value for a field in sql query;django
I am not able to open the Django admin file;django-admin
Generating a random image to test ImageField in Django;django-models
Why i am not grtting user by request.user;django-templates
DNS CNAME records on two levels of subdomains;dns
How to set a custom domain for Azure Virtual Machine?;dns
How does linux virtual machine in windows use GPU in workstation?;docker
Notary Image Signing Certificates architecture TLS?;docker
Docker networking with IPv6;docker
How can I update the composer version that is being used inside my ddev containers?;docker
Hyperledger Fabric - Multi Host Network - Docker Swarm;docker
Can we run the node chrome & firefox images on Kubernetes?;docker
Re-use Dockerfile with different base image;docker
Kubernetes / Docker - SSL certificates for web service use;docker
How to escalate kubernetes container privileges for pod securityContext runAsUser: 1010;docker
Vim Docker Container doesn't work on certain terminal/ssh sessions;docker
Guard not triggering when using WSL with /mnt/c windows volume;docker
Can you download Docker images with no Docker in the VM?;docker
Docker won't startup;docker
How can I change permission on folder inside Dockerfile;docker
Encountered an error during hcsshim::System::CreateProcess: failure in a Windows system call: The system cannot find the file specified. (0x2);docker
Is it possible to mount ISO file while building image by Dockerfile? [duplicate];docker
Connecting from gatling simulation inside Docker to localhost;docker
Prometheus alerting when a pod is running for too long;docker
Docker container not updating on code change;docker
Migrating Docker Compose to Kubernetes Volume Mount Isn't Supported;docker
Unable to start Cassandra docker image on Win10 Home;docker
Is it possible to reuse an existing stopped container when docker-compose run command is fired?;docker
Where does docker bridge send network packets?;docker
NestJS: Microservices with Docker;docker
Get error when i add a new library to my pipfile and run docker-compose;docker
Why am I seeing two different values of host.docker.internal and why the cassandra container can't bind to it;docker
Could I build a redis-cluster with 3 master-nodes,each of them in different servers?;docker
GitLab deploy token fails on EC2 Ubuntu 18.04 AMI, and nowhere else;docker
How can access to NFS datas in GitlabCi job?;docker
Docker Swarm Overlay Network Between Workers;docker
Docker Setup For Networking Application Development;docker
Is it safe to build an unknown Dockerfile?;docker
PIP installing TA-Lib in Dockerfile on kubernetes;docker
How to detect the host OS from container?;docker
docker-compose environment not getting set;docker
How to map multi-stage docker to multiple Jenkins stages;docker
Docker in Linux VMware on Windows host [closed];docker
Docker on jenkins slave return premission error while runnig docker commands directly on the slave works well;docker
Google Cloud Engine pull public docker image causes manifest unknown error;docker
building shared package of monorepo before building docker services;docker
Get container id from tag name;docker
Should I run my Containers on Kubernetes or on Cloud Foundry? [closed];docker
It was not possible to find any installed .NET Core SDKs in docker-compose;docker
Logs not getting sent to AWS Cloudwatch when docker in detached or foreground;docker
Update and Upgrade inside a docker file to get latest security patches;docker
Jira via docker-compose crashes on startup;docker
Could not connect to ports.ubuntu.com:80 while execute `sudo apt-get update` command;docker
ansible plybook script for destroy all containers and remove images from remote;docker
Dotnetcore 3.1 memory allocation in Docker;docker
Dockerfile: Combined run statements don't work correctly?;docker
Docker Installation Problems;docker
Standard Filesystem Dockerfile;docker
Extract service in docker-compose to Dockerfile;docker
Send jmeter.log also to console standard output;docker
issues running keycloak server on docker container in plesk;docker
KubeMQ Single leader cluster?;docker
Package Analysis in Docker Image;docker
Elastic with Kibana on docker gives Kibana server is not ready yet;docker
Configure Airflow Worker;docker
communicating between docker containers/services;docker
Suddenly my cron tab doesn't work in Docker;docker
How does docker overlay network work if the master and minion are in different subnets in AWS;docker
Having to repeatedly restart docker because of a iptables error;docker
How can I use environment variable notation within .env file used by docker-compose;docker-compose
docker compose to delay container build and start;docker-compose
How can I use docker-compose in a bitbucket pipeline to deploy to a remote host?;docker-compose
Rotate docker swarm configs without restart;docker-swarm
Can we increase waiting time to update stack in docker swarm?;docker-swarm
Adding new tab to docusaurusv v2 navbar;docusaurus
What happens to Docusign envelope notifications when webhook fails?;docusignapi
Export/Import of DNN site;dotnetnuke
DQL To find out how many users havve logged in to store;dql
draft-js toJS and fromJS EditorState;draftjs
Angular CDK drag-drop with zoom by CSS-property “transform: scale(0.5)” doesn’t work as expected;drag-and-drop
robot passing through the floor;drake
Bypassing HDCP protection;drm
Kie-server performance issue while evaluating rules and updating rules at the same time;drools
Drupal, in a content type display some text depending on the value of a date field;drupal-7
Attachment preview doesn't render HTML file d365;dynamic
how to apply dynamic attributes clustering algorithm;dynamic
How to add buttons to crm vanilla grid;dynamics-crm
In Dynamic CRM how to track export data from report;dynamics-crm
How to add buttons to crm vanilla grid;dynamics-crm
KSH : Display Wait message while processing a command;echo
Line is skipping in BIRT Viewer when combining two dataset;eclipse
Eclipse is very slow on Save Action. Any way to improve this?;eclipse
install problem of lombok in eclipse neon. I tried to find it's solution. but no proper solution found;eclipse
What is Unicode “ID_Start” property referenced in the ECMAScript spec?;ecmascript-6
Meaning of ECMAScript notation syntax?;ecmascript-6
Building search tool to search and filter in Tableau [closed];elasticsearch
How to get last update time for an index in elasticsearch;elasticsearch
ElasticSearch simple match;elasticsearch
Vega cubes creation;elasticsearch
ubuntu server cpu utilisation increasing very quickly after installing ELK;elasticsearch
how can i view the elasticsearch data in indeax, how can i create the schema to kafka topic twitter data;elasticsearch
Elastic Search personalisation in page 2, Rescoring not impacting first page results;elasticsearch
Kibana server is not ready yet even started;elasticsearch
ElasticSearch : 'IN' and 'AND' operators;elasticsearch
Problem indexing LongField from custom FieldBridge;elasticsearch
How to get multiple fields returned in elasticsearch query?;elasticsearch
What can be the best way to set centralized syslog management system for network devices using grafana?;elasticsearch
How to get last update time for an index in elasticsearch;elasticsearch
Aggregate by field values with counter;elasticsearch
Best practices for writing a PUT endpoint for a REST API;elasticsearch
Elasticsearch query all documents where keyword value is greater than X [7.2];elasticsearch
ubuntu server cpu utilisation increasing very quickly after installing ELK;elasticsearch
Can’t get index.max_result_window for Elasticsearch 7 working;elasticsearch
TypeError: Error processing argument at index 0, conversion failure from #(WebContents);electron
How to remove trailing zeros after decimal in Elixir/Phoenix?;elixir
assign @categories not available in eex template;elixir
I can't install org-checklist;emacs
emacs: Finding a substring in a string using (string-match);emacs
Heroku / PointsDNS - how to make record visible publicly;email
Creating an email address if it doesn't exist in my domain;email
What are the steps to transfer a domain?;email
Mailgun: send a follow-up email if original email wasn't replied to?;email
Jenkins - Error sending to the following VALID addresses:;email
Allow customers to send from their own domain in a SAAS application;email
Is it necessary to include plain text URLs in e-mails that have clickable links?;email
How does Slice and TripIt worksssss;email
Disabling Click on Vimeo Video embedded to Survey Monckey;embed
I2S Data Structure (Inter-IC Sound);embedded
ffmpeg monochrome rawvideo;encoding
Axios not encoding sumbols;encoding
Configuring Cipher Suites in Windows Server 2012 R2;encryption
Using AES encryption QC3ENCDT and PKCS#5 padding;encryption
URGENT! Doubts regarding (project)hybrid encryption in cloud for security and deduplication [closed];encryption
SRTP AES encryption;encryption
Problem with EF Core - I don't know how to disable cascade deletion;entity-framework
Soft delete and cascade deletion doesn't work as expected;entity-framework
dotnet-ef does not exist - Windows 10 WSL;entity-framework
ThenInclude missing in Entity Framework Core 3.1.4?;entity-framework-core
grouping data after leftJoin in ef core 3.1;entity-framework-core
EFCore 3.1 FromSqlRaw is not working and throwing a bizarre error message;entity-framework-core
Inside sudo, environment variables are not set when command is inline versus calling a second script;environment-variables
Getting the API_KEY from SendGrid .env file (Node.js);environment-variables
Angular error intercepting runs infinitly;error-handling
Can Promise resolve multiple times?;es6-promise
eslint rule to required imported objects to have the same name as file?;eslint
ESP32 Transfer file Using BLUETOOTH;esp32
Windows network device driver: set network interface name;ethernet
How to embed Eventbrite Checkout;eventbrite
vscode event start create a folder;events
Cucumber ConcurrentEventListener implementation mechanism does not work when tests executed on Docker container;events
Excel file handling in clojurescript using sheetjs package;excel
Combining VLOOKUP and IFERROR in formula;excel
object doesn't support this property or method CheckBox ControlFormat.Value =1;excel
Keep function references from changing when a new row is added to another worksheet?;excel
Adjusting display depending on users screen resolution?;excel
Updating the time when a value of a cell in a row changes;excel
Need update next cell on next day in excel;excel
Rearange excel sheets using matlab;excel
Powershell - Importing XLSX to Active Directory;excel
Conditional copying with looping [closed];excel
PowerPivot Column Name Issue;excel
Converting a multi column Excel table to two columns [closed];excel
Find the smallest sequence of move needed to re-order rows according to an array;excel
Extracting dynamic content Web scraping;excel
Excel dynamic chart not updating from table;excel
Copy worksheets from a master workbook to active workbook;excel
Find what sizes can be made of an item [closed];excel
Element not interactable - Selenium Error [duplicate];excel
Set the cell format to text in excel before importing;excel
Using COUNTIF function for the flexible range on cells;excel
How to print the datatype of a cell present in excel using night watch?;excel
Transfer sentences from Word files into an Excel file;excel
How to display Word Document?;excel
VBA / Excel - Fill formula down till last row in column & select a file;excel
Send an email if the cell contains the word “expired”;excel
Copy Word file table to Excel file (merged cells and multiple-line cells);excel
Insert a row below the last row of a Table and keep the same format and formula;excel
How to convert time stamp with text into a date;excel
Copy/Pasting Data from Excel with Line Breaks Adds Quotation Marks and Treats Data Differently [closed];excel
How to search for a secific file within an archive (.rar, .zip) file using Excel VBA? [closed];excel
Keeping one column of information independent from the rest of the spread sheet;excel
Possible to change following macro from saving PDF to saving sheet as xlsx?;excel
Why is folder creation macro causing Error Code 6?;excel
Comparing cell values;excel
Excel: Get Data From Workbook not getting all rows;excel
In Excel 2016 VBA, how can I get an IF statement to run if it finds a match in a table?;excel
Selecting only up to the rows with values using inputbox [closed];excel
commandbutton click to open different userfoms based on listbox selection vba excel;excel
Getting error 91 - Object variable or With block variable not set;excel
Is there a way to set an automatic email to trigger in Excel vba when a specific drop down answer is chosen?;excel
Why does this VBA code not make any changes to my excel sheet?;excel
Can I force 32 bit VBA references in my Excel Macro?;excel
Getting the width of a master shape in Visio;excel
matching hourly data between 2 pivot tables;excel
Importing a Table;excel
Count cell values in corresponding cell based on the value of another cell in the same row;excel
Is there any Excel Formula for comparing 2 columns for containing data and counting their occurrence?;excel
Run auto-open of the reference file;excel
How do I create Pass/Fail/Score Pivot Table without adding formulated columns to the data?;excel
Sliceritems value in different languages (value “blank”);excel
Copy Specific Sheet of multiple workbook to multiple sheets of another workbook;excel
Search from excel using google maps [closed];excel
Is there a way to import a test cases excel sheet to VSTS?;excel
Make graph from csv file A and put graph on file B;excel
Application similar to Excel saving in TEXT FILE FORMAT [closed];excel
Count the matching entries in two different columns;excel
(SOLVED) Display picture as LONG BLOB from SQL Server into Image Control using ADODB Stream;excel
Check if the user has macros enabled;excel
Unable to set the Visible property of the PivotItem class Question;excel
Hide multiple worksheets and diplay only one worksheet vba;excel
Grab header name of all max values;excel
ComboBox from filtered list;excel
Associate a Module to a worksheet;excel
MS Access Linked Excel File “External table is not in the expected format.” [closed];excel
Adding Dates resulting in times past Midnight;excel
#VALUE error when setting Interior.ColorIndex with Sub called from UDF;excel
Script to compare strings [closed];excel
Copy Word file table to Excel file (merged cells and multiple-line cells);excel
Skip error “The document caused a serious error the last time it was opened”;excel
Transform a column into two columns in sheet with many columns at the same time;excel
Making an attendance system using own website and Office [closed];excel
EXCEL, is this possible [closed];excel
Deleting text that is a certain color;excel
Copy row from one sheet to recent sheet;excel
Why calculations with variables give a different result than calculations with cell references?;excel
“You Typed an Invalid name for a sheet or chart”, Need to update the code;excel
Countif with reference to different sheet;excel
Excel add in not loading at startup;excel
ELSE always executed, despite boolean [closed];excel
Excel: Power Query Editor: Data Source from Web has Changing Columns;excel
Using VBA & VLOOKUP to reorganize column ranges into rows;excel
Excel: saving model output in a column, but only if the output is different from the previous;excel
Selenium Chromedriver Won't Keep Me Logged In When Interacting With Website… Sometimes;excel
Need a formula to determine the maximum number of days between multiple consecutive dates;excel
Assign value based on named range/cell;excel
How can I open .xlsx directly in Google Sheets?;excel
Search UPC barcode with barcode scanner;excel
Populate Listbox Multiple Column With Criteria;excel
Calculate stock in an particular order [closed];excel
Check two columns for matches then edit a cell;excel
Save a spreadsheet in a distinct folder in a local drive;excel
Excel Connection Error: DataSource.Error: The underlying connection was closed: An unexpected error occurred on a receive;excel
How to automate Vlook from different worksheets to macros;excel
Setting a variable depending on the OptionButton selected in the Frame;excel
Copy same column from multiple worksheets to new worksheet;excel
How to prevent picture from being shifted around or deleted by other users? [closed];excel
Save without dialog box [duplicate];excel
Import excel with leading empty cells removes commas;excel
Get cell contents on drop down change;excel
create an excel table from data in several worksheets;excel
Dynamic border offset with merged cells;excel
Region independent number concatenation in Excel;excel
Input 20 elements as one;excel
How to change specific values 1 by 1 of a worksheet based on conditions from another worksheet in VBA?;excel
VBA Macro from Word to Excel in table format?;excel
Excel load the previous record allocated for the given cell value;excel
PowerBuilder’s OLEObject object type doesn't read data from the file as expected but reads from somewhere else, Is it a data caching issue?;excel
SSRS Export to Excel causes text alignment issues?;excel
How to loop through powerpoint slides using excel vba to write data based on slide;excel
Set reminder task date in Outlook;excel
Insert text from Word into a mail based on a value;excel
can I automate query refresh and email as attachment with power query/vba?;excel
SUMIFS can't use in vba code but i can use in excel function;excel
Highlight Duplicate Rows When Conditions Met in Multiple Columns i Excel;excel
Condensing a huge 2D array in Excel;excel-formula
Calculating amount of Jam labels - negative values and roundup/down - excell/GSheets;excel-formula
Concatenating CHAR(10) in Fomula ignores line break;excel-formula
Empty response Body on HttpClientErrorException;exception
Getting error code 500 no matter what error I send from express using a error handler?;express
How to Customise the Extent Report by removing unwanted graphs and Extra space;extentreports
Extjs 7 Calendar select day Compact mode;extjs
F# algorithm for hk;f#
Is there an api where I can retrieve facebook messenger messages?;facebook
How to remove a user from Facebook custom audience added from pixel?;facebook
facebook login trapped in a loop if open in facebook app;facebook
Does sparkAR support macOS v10.10?;facebook
Collect comments of Facebook pages and groups not owned without an app for data science project;facebook
Whatsapp media messages using twillio;facebook
Re-asking for declined facebook permissions;facebook
Is there any way i can get the number of a user's followers/friends on a particular date?;facebook-graph-api
Facebook API - How to get admin_creator data for all admins not just myself;facebook-graph-api
How does Facebook mutate it's cookie without refreshing the browser to go from no access token embedded to having an access token?;facebook-graph-api
I can't login with facebook in laravel socialite , where it works for google and github;facebook-login
I can't login with facebook in laravel socialite , where it works for google and github;facebook-login
fastify session is throwing something that I dont understand;fastify
FFmpeg conversion commande not working, file not found excepiton;ffmpeg
MPV (FFmpeg) stack 2 videos and then crop output without re-encoding?;ffmpeg
Rotate a h264 video using the Display Orientation SEI;ffmpeg
ffmpeg replace audio with filter complex start and end time [closed];ffmpeg
ffmpeg - How do I compress a .mov file with partial transparency, while keeping the partial transparency?;ffmpeg
Ffmpeg “-c copy” alternatives for fast video cutting;ffmpeg
FFmpeg filter complex add audio file to video at specific points;ffmpeg
compiling ffmpeg Ubuntu 16;ffmpeg
libavformat stuck in ff_network_wait_fd;ffmpeg
ffmpeg english subtitle is missing from converted .mkv file;ffmpeg
what is the logic behind Makefile patterns?;file
Post File object within an array of object with Axios?;file
how to hide files or content in file manager in both android ios;file
Reduction of Transaction Log File Size when in Simple recovery mode;file
Where can I find example code using vkGetFenceFdKHR? [closed];file-descriptor
Is it less expensive to serve signed or unsigned URLS from Google Storage?;file-upload
Execute function daily at 3 PM - Firestore;firebase
problem in flutter with fireStore in QuerySnapshot its always null;firebase
Error: Problem in switching bw Multiple Tabs. Flutter;firebase
Im unable to authenticate login/sign up of a user with firebase in my application with flutter;firebase
problem in flutter with fireStore in QuerySnapshot its always null;firebase
Firebase Push Notification keeps stopping my Flutter Application;firebase
displaying images through map by getting download url from Firebase Storage;firebase
storage.refFromURL is not a function in firebase;firebase
Implementing localized 404 page with Firebase hosting;firebase
Is there a way to implement a reporting feature in a React Native app?;firebase
How do I get the key of a value in FirebaseDatabase using Flutter / Dart?;firebase
Firebase Security - User claim to assert Sign In from App;firebase
How to serve firebase functions locally without deploying;firebase
Is anyone trying to hack into my Firebase app? I see lot of weird gmail login but no user account is created in my firestore? [closed];firebase
When using db.collection('…').add({…}) can bad words appear in the random id?;firebase
Get 1 document at a time inside a Firestore collection, without passing any key or filter, just by the order in which they where added?;firebase
Connecting Firestore emulator to flutter_test;firebase
Limit the retrieve of documents from Firebase on Flutter;firebase
Fail to call firebase 'onCall' function in front end due to CORS policy;firebase
how to compare two collection in Firebase flutter application?;firebase
How to Read data from 2 different Firebase database which are from 2 different projects;firebase
Flutter Async/Await Does not work in forEach loop;firebase
Is it OK to use set-timeout for implement timer in turn based multiplayer game while using Firebase Cloud Functions?;firebase
displaying images through map by getting download url from Firebase Storage;firebase
Allow anyone permission in firesbase even in production;firebase
How to skip `(Y/n)` prompt when running firebase login;firebase
Fail to get datas from Firestore using firebase api when do the Live Test on the GoogleSearchConsole;firebase
Is there a way to move multiple collections under one sub-collection in Firestore;firebase
setUserId() method is overriding the value of Device ID dimension in Exploration reports;firebase
How do I see Daily Active Users from Firebase Analytics?;firebase
Unity3d and Firebase error downloading files gave me error. Error 403;firebase
How to remove EXIF data from file uploaded to Cloud Storage via Firebase;firebase
Flutter Web Config File Privacy;firebase
How to Set a Rate Limit for Document Creations in Firestore Server-Side?;firebase
Wrong document id in firestore query;firebase
How to use paging in Firebase with stream;firebase
Firebase Cloud Functions: check for revoked token;firebase
Flutter/ Firebase The getter 'length' was called on null;firebase
Cross Origin Null Forbidden in Firebase Cloud Function;firebase
How can I set Firebase hosting location [closed];firebase
i amtrying to deploy mon web app en firebase and i all i get is this error ! Your requested “node” version “8” doesn't match your global version “12” [closed];firebase
To show value in the textfield in flutter;firebase
Flutter: Prevent users from changing device from the backend;firebase
Firebase Cloud Messaging create/add device group API response;firebase-cloud-messaging
flask_sqlalchemy passing around db instance to multiple modules;flask
two domains one flask app, with subdomains;flask
How to deploy flask app where I am using scrapyrt for scrapy and flask to display it. How to deploy it on server;flask
flask NoAppException but flask run works;flask
Redis caching and queuing on same server?;flask
Flask deployed on httpd server has method not allowed but working on werkzeug local;flask
ERROR:flask_appbuilder.security.sqla.manager:Error adding new user to database;flask-sqlalchemy
