question;post_tag
Change plotly scatterpolar labels manually;python
federated learning with two separate datasets;python
Python - Create bezier curve, return points on curve [closed];python
How to rotate theta ticklabels in a matplotlib polar plot?;python
Python Re.Search: How to find a substring between two strings, that must also contain a specific substring;python
Python 3.8.3 readline module custom tab completion works in interactive mode, but not when running a script;python
How to skip attachment(Email Attachment,Image etc) while parsing email in Python?;python
Hairstyle replacement/transfer using python [closed];python
Run for loop over subsets in Python;python
Is there a special task I need to do when I'm reading 2 arduinos at the same time with python?;python
How do I add numbers I've iterated into a list to a string?;python
Fill column with nan if sum of multiple columns is 0;python
How to structure Python packages with Sub modules;python
How to show more categories in a Matplotlib line plot of a Pandas DataFrame Pivot Table?;python
How to do a call of function of table name with tables n with a limited cursors m where m(n repeatedly?;python
Should namedtuples always be defined at the module top-level? [closed];python
python replace backslash and single quote;python
gettiing an error when trying to send an email with smtplib;python
Can't open jupyter notebook due to jsonschema [already tried other solutions on stackoverflow];python
Unique identifiers for TensorFlow 2 tensors?;python
Fundamental OOP in Tkinter;python
Game Wont Restart after Game Over;python
Is there any async python gzip library to unzip and read files [closed];python
Locating entities(like square, rectangle) on sphere as shown in image [closed];python
How can i print Values from the first column from a CSV file and fix this error?;python
Recommended way to replace several values in a tensor at once?;python
Post order to oanda API using requests in python;python
How to run pytest with mysql docker container?;python
Random number generation in Tensorflow is very slow (tensorflow-gpu);python
Python SpeechRecognition Can't Find File;python
How to display HTML and Javascrip objects rendered inside ipython cells in a browser without any cells;python
Why training is good but cannot predict anything even the training samples;python
Selenium-Python how to keep click on reCAPTCHA body?;python
c++ boost python: add own packages;python
Implementing gradient for gradient method;python
Pandas: How to control display options for columns that has arrays/lists inside them?;python
Error when importing tflearn on mac: ModuleNotFoundError 'tensorflow.contrib' [closed];python
Extracting option dates from yahoo finance;python
ValueError: x and y must have same first dimension, but have shapes (1,) and (224, 224, 3);python
How to pass input value to input() using pyqt5?;python
Is there a way to use server-side Python code in HTML? [closed];python
anaconda navigator Jupyter notebook startup problem;python
Beautiful Soup and Splinter - get href and src attributes;python
Multuiprocessing not executing a function properly in python 3;python
Dilemma trying to bind this code with the following code to make a password to enter program;python
Shell sort shows “list index out of range” and I can't figure that out;python
Get the equivalence of input(“What is your name”);python
Best practice for handling errors in python;python
Regular Expression to find “ABA”, “AABBAA” or “AAABBBAAA” (until infinity);python
How to kill a docker created with python subprocess.Popen() when the parent dies?;python
Library not loaded: @rpath/libomp.dylib Reason: image not found;python
Unexpected valid syntax in annotated assignment expression;python
Unable to print test results;python
“-bash: twine: command not found” when attempting to upload to PyPi;python
No change in train & test accuracy and loss;python
How to make font change its size to fit in the window using turtle?;python
When to apply the data preprocessing in machines learning models;python
Prodigy + Spacy to train dataset;python
Still after convertion into grayscale can not use cv.equalizeHist() in OpenCV. Gives error: (-215:Assertion failed) _src.type() == CV_8UC1;python
Move the z axis on the other side on a 3D plot python;python
Having issues with my first python web scraper part 2 (The Sequel);python
julia.core.JuliaError: Exception 'ArgumentError' occurred while calling julia code: using PyCall;python
NameError: name 'useraction' is not defined;python
How do i automatically download file using Python and Selenium without clicking Save button?;python
FileNotFound error / reading PDF Files with PyPDF2 and os.listdir();python
How to change sys.path to a static location that works for everyone?;python
How do i automatically download file using Python and Selenium without clicking Save button?;python
Assign “True” to for loop containing an if statement that triggers an email if the for loop is True;python
Saving/Loading a Keras model with custom methods;python
Gensim: extract 100 most representative documents for each topic;python
AttributeError: 'Ui_MainWindow' object has no attribute 'clk' in pyqt5 and Selenium [closed];python
Why is Pulp is infeasible but has the correct answer stored in a “second version” of one of the LpAffineExpression object;python
How to add cards to a list and then transfer those cards into a players hand after they have won?;python
How to solve Internal Server 500 on python, in xampp localhost;python
Why is my break statement not performing as I would expect it to?;python
Numpy replace values;python
Extract value of variable of a running ipyhon3 shell;python
Webscraping with loop and writing to csv;python
Running a Levene's test over a list instead of separate vectors;python
Why do I keep getting a multiValueDictKey Error in my Django/Bootstrap project?;python
Python - Choropleth Map JSONDecodeError: Expecting value: line 1 column 1 (char 0);python
tokenise on white space ONLY | sklearn - TfidfVectorizer | Python [duplicate];python
Reformat from datetime64[ns] to date[d];python
Issues with ibapi program;python
How to get the processor temperature in Python?;python
LEMMA :: The pipeline needs to include a tagger in order to use Matcher or PhraseMatcher;python
Python: how to create a csv column based on a function's parameter;python
Group in a new list every 60 elements [duplicate];python
how to get user input without pressing enter in python?;python
Can to detect if python performed a module import or tried to execute it?;python
Iterating a list to get the three highest numbers of each group;python
Looping and checking if its time for refresh.. is threading a solution for this?;python
Selenium: how to understand which element to send keys to?;python
Creating a circular density plot using matplotlib and seaborn;python
Creating a Keras function;python
Is there a way to combine an audit script with a Flask app?;python
Math operations with multiple dataframes having different size;python
Share Python ChatBot with other users;python
Cannot use tensorflow add_to_collection with tensorflow-gpu package only;python
converting python try-except (or try-catch) code block to VBA for basic excel-selenium application;python
Dash data_table background color for individual cell;python
What's the meaning of these lines of code in function definitions (in tkinter app)?;python
How to detect contours in a license plate - Opencv;python
Compare values and color Pandas cells based on values from other columns;python
CS50 PSET7 Houses “import.py” SQL error - specifically: sqlite3.DatabaseError: malformed database schema (?);python
Look for n-grams into texts;python
Turn off all Bokeh Axis Objects;python
Switch between scatterpolar plots in plotly;python
How to execute only particular part of the scikit-learn pipeline?;python
Heroku scheduled function using Heroku Scheduler Python;python
How to forcibly free memory used by dictionary?;python
Using sphinx + nbsphinx to convert a jupyter notebook to a HTML file, but the hyperlinks in the notebook are missing in the output HTML;python
How can I make a code that displays buttons on one half of a tkinter frame and a plot on the other half?;python
For loop padding print statements of dictionary by longest key;python
How to detect a contour or spot on the edge?;python
Number of time steps in one iteration of RLlib training;python
Difference between lambda and assignment;python
How to automate data pull from Adobe Analytics?;python
the new line character is not working for my program?;python
How can you write to a text file in python 3?;python
Problem with pygame - failed loading libmeg123.dll;python
How to run Python script in venv?;python
What's the best way to handle when a constraint evaluates to infinity in OpenMDAO?;python
Game of Life returning all dead grids. What to do?;python
problem in reading a dataframe from a csv file: Delimiter is used in one of the designed variables;python
Get folder content from S3 bucket;python
replace value and divide it with pandas;python
How do I get rid of label overlay in PyQt5?;python
Flask: Simple site to export tables on DB to CSV;python
Random Forest In Python [Error in r2_score];python
Asynchronous IPC between Node.js/Electron and Python;python
Sharing multiple instances of shared memory between python processes;python
Translating Mapping long/lat code from R (sp pkg) to Python;python
urllib urlretrieve only saving final image in list of urls;python
Errno 10060 when using smtplib to verify emails;python
How to make a Python project executable?;python
Passing the data from a sign up form through a python script to create a new field in the user database in Django;python
How do you execute code from another file in an if statement?;python
Make broken loop run again? [duplicate];python
How to change layout of a transposed dataframe using pandas;python
kivy : missing 1 required positional argument: 'instance';python
blackhatpython WindowsError: exception: access violation writing;python
Python grouping list elements into groups that all elements are grouped;python
Fast, vectorized groupby-apply with qcut in `pandas`?;python
Problem restoring the default custom.css file in Jupyter Notebook/Lab;python
(Selenium) Running many firefox browser with less performance [duplicate];python
jinja2.exceptions.UndefinedError: there is no parent block called 'scripts';python
dj_database_url() loads empty dictionary for DATABASES when running locally;python
w can I write unit test tests in python? [closed];python
tf.keras.models.clone_model unknown activation: ReLU;python
Why does my code return True when it should be False if the number of substrings do not equal each other?;python
pickle.loads gives 'module' object has no attribute '(ClassName)' inside a Pyspark Pandas Udf;python
Selenium not able to upload image to Instagram?;python
Python3 question about dictionaries from a newcomer to the language [duplicate];python
Scatter data fitting the best line and showing the uncertainty associated with the slope and intercept;python
Python integration with Podio;python
Python, Tkinter - How to get text from Entry;python
Dataframe to Dictionary, with all same column values within a nested dictionary;python
How to make ''string in list'' case-insensitive in python3.8.3;python
Is there a “non-hacky” way to update PyQt5 Apps (Python)? [duplicate];python
Anaconda\Spyder without proxy;python
What does overlaying parameter of layout.axis object of plotly mean?;python
Trying to make ⬅️⬇️⬆️➡️ for a game [closed];python
QSqlTableModel setFilter too many arguments;python
Error while trying to retrieve Twitter geolocation using Tweepy;python
Filter and list specific file names;python
Handling (class 'nltk.corpus.reader.wordlist.WordListCorpusReader') in Python;python
Trying to make ⬅️⬇️⬆️➡️ for a game [closed];python
Python Membership Operators “In” TensorFlow Datasets;python
The task per lines is to bring them to the same single line;python
Django: Does the virtual environment have to be on every time i develop my django app;python
Python & Selenium: Iterate through list of WebElements Error: StaleElementReferenceException;python
Filter the pyspark dataframe based on values in list;python
Uploading MANY files at once with Flask-Dropzone;python
Plotting users by recording time (timedelta64 format);python
How to execute methods in a class using Selenium and Python;python
Add TensorBoard to application;python
Filtering 2D numpy array by its unique value combinations;python
Windows 10 Toast Notifications quits my PyQt app when it's done;python
Topic modeling on short texts Python;python
How can I check the fully qualfied method name of a package imported in another python module;python
'Context' object has no attribute 'reddit' Discord.PY;python
How to delete an item in Pycairo;python
How should I investigate strange behaviour of a Python script in various machines?;python
How do I separate the values from an .obj file into an x array, y array and z array in python?;python
Tensorflow: Inserting a subset of a slice;python
How to bypass Recaptcha for BeautifulSoup in Python?;python
Python: How to include table prefix in mysql result header;python
Opening new window while out of focus using “keyboard”;python
AttributeError: 'Member' object has no attribute 'public_flags';python
How to extract mutlple fields from a json documet with Python?;python
append method overwriting instead of adding to list [duplicate];python
How to make corner round and center align text in frame option pysimlegui python;python
How to make pandas data in steps via vectorization?;python
Tensorflow ImageAI GPU usage;python
Python | Is there a way to get my IP address?;python
How to convert the type of a column from String to Date;python
Unexpected action distribution for custom RL environment;python
Merge dataframes with repeated keys;python
How to split .txt according the column?;python
Using cartopy to plot a binary map of Earth;python
How can you make a Discord's bot commands not case sensitive?;python
Add figures in new subplot in Python;python
Error when trying to download a virtualenv on mac;python
Parsing a .txt file in Python to a Numpy Array;python
Python: what does example[i::i] do [duplicate];python
Django Rest Framework: Custom IsReadOnly Permission;python
Mechanize - form has no submit button;python
How can i write raw data?;python
PyQt subclassing QSqlDatabase to make exceptions;python
Annotate each query with a function of itself;python
IndexError: list index out of range when creating a list with variable as number, but works fine in print, why?;python
How to pass parameter on asyncio.get_event_loop().run_until_complete();python
Streaming RaspberryPi camera to a C# Windows Forms-App over a existing Websocket;python
How to find index in a string format for a particular value in a column of a pandas dataframe?;python
MapReduce streaming job failing, though it runs good in local shell;python
Plotting tree with XGBoost returns Graphviz error;python
How to reference handlers in sub-directories in serverless-offline?;python
How to iterate through XML children node in scrapy with python?;python
Can't assign a numpy array to pandas dataframe;python
What is the difference between tuples and lists when constructing a structured array?;python
Python ibm_db List in the Where Clause;python
Code for ball gets the error - ball = Ball(canvas, paddle, 'red') TypeError: __init__() missing 1 required positional argument: 'color' [duplicate];python
Python - Finding optimal single character wildcard combinations to compare two lists;python
Allowing Tensorflow to Use both GPU and Physical System Memory;python
SparseTensors in tf.data.Dataset, incorrect input shape or not same nested structure;python
How do I if int(q1) == 174: but for letters [closed];python
Apply a function on sub-tensors in a way that can be parallelized (Pytorch);python
pySpark withColumn with two conditions;python
Python line_num printing the line number outputs only the last line number;python
Is there an implementation of the PyObject class that allows you to properly override magic methods?;python
Atom script wont run command;python
Count instances of event (by type) per combination of columns;python
SQL iterate UPDATE from python list;python
Can you tell me what deploy.prototxt in Caffe model is for?;python
How to save local data to a database in django?;python
SQL Query rounding issue;python
need help finding solution to deciding turns for tic-tac-toe;python
How to end a for loop completely python;python
InvalidArgumentError: axis = 0 not in [0, 0) when using custom loss function for training. tensorflow py_function is used to compute scipy function;python
read file and datetime in python;python
Update values in numpy array with other values in Python;python
Cumulative sum on specific column with groupby on last n_days;python
Transfer Function as Second Order Section;python
SSL: CERTIFICATE_VERIFY_FAILED certificate verify failed: self signed certificate (_ssl.c:1076) Python ssl and sockets [duplicate];python
Decompressing a base 64 encoded GZip with Powershell;python
Why previous values of dicts inside other dicts keep getting updated?;python
How to make web page Bokeh plot appear with same clarity as show(fig)?;python
In python, how can I fill up each bar in a bar chart with its constituent data?;python
Can't insert DateTime into SQL Server from Python;python
Twitter no longer works with requests library python;python
How to put a file called “ranks.dat” into three fields, ranks, power, and number;python
Replacing letters in string w/values in dictionary;python
How to add a link to a template form to extend the form to the corresponding id?;python
pyautogui hotkeys not working while automating process in jump server;python
Cannot read properly 'data ' of null (DASH);python
I have panda sql query syntax error I don't understand;python
Assigning key value pairs based off list of objects attributes;python
ModuleNotFoundError: No module named 'pillow' on Pycharm (windows 10);python
Python PyQt5: how to send my app to system tray by pressing a button, and showing app window from system tray?;python
Failed to open the new environment (created in anaconda) in jupyter. Geting the error “ImportError: No module named 'win32'”;python
How to use '+' as input;python
How to share global variables between files in Python like C;python
python-telegram-bot webhook doesn't work?;python
How to create plugin for nifi in python language;python
Train accuracy much higher than test accuracy;python
Tkinter Add Background Image;python
why does tkinter root in Python need to be created first?;python
Pandas: Checking to see if an entry in a pandas dataframe column is empty;python
How to combine marshmallow-dataclass with marshmallow-oneofschema for polymorph structure?;python
Add edges with python igraph;python
Cannot upload a file using autoit in selenium python IE 11;python
Ctype has no attribute error found in the code;python
How give 2 parameter in PUT method?;python
I want just the first column to be clickable in QTableWidget using pyqt5;python
Parallel execution of a function in Python;python
Problems using numpy.piecewise;python
multi label with pyspark;python
How to iterate over dataframe multiple columns in pyspark?;python
display element difference between 2 arrays;python
Why is my index not changing while removing things from this list?;python
Windows pip is configured with locations that require TLS/SSL;python
Filtering and manipulating “None” or “Null” rows in Pandas dataframe;python
Why is wsgiref.simple_server faster when we return a string wrapped in a list vs just a string?;python
Reload template variable without refreshing in django;python
Add a key with multiple values to nested JSON;python
Submitting a form and getting results Python Requests Post;python
Can't update second row of the database;python
precision percentage of knn classifier in python;python
Fibonacci sequence in python using generator;python
Removing rows from one dataframe that appear in a second or third dataframe;python
Cryptographically Guarantee Integrity of Python Code [closed];python
psycopg2 - Unkeyed Connection error in multithreading;python
Python: query performance on JSON vs sqlite?;python
Using variables for longitude and latitude with google places API [closed];python
covert cURL in to python code and getting (Response [400]);python
Where statement in pandas;python
Why does loading a jpeg or jpg image changes it upon saving everytime?;python
Explain the time and space complexity in this solution to generating zero matrix;python
So i wrote a code for a discord bot that is just slapping some text on some bg with turtle module and it's working rly bad;python
Sum of a list within a list in Python [duplicate];python
Pandas Dataframes, How to get rid of NaN and Dublicates per specific column or index?;python
How to create new pandas dataframe column containing values of all other columns as a tensor?;python
CURL request is not capturing data in Flask app when passed request using POST;python
awk compare 2 columns in 2 unsorted files and return specific columns in 2nd file after match;python
How to get the parameter name of an argument passing into a function in Python?;python
Custom help in python click;python
is there a way to deploy my ML model in python tkinter;python
How to iterate twice over a list with different conditions?;python
Gudhi can be imported as a module, but not as a package;python
Got an error while running an app (ModuleNotFoundError: No module named 'tornado.ioloop');python
How do I make my character move more smoothly/make the background synced to my character?;python
Python Dash - Combining two callback functions;python
Date value did not match format specified [YYYY-MM-DD] Error in Psycopg2 while COPY;python
A problem with compatibility of the script on Windows;python
Is there any way I can make a Jupyter notebook script work as an (i)python script?;python
Having trouble storing the results of a rock paper scissors game;python
Why is this Python GUI crashing after requesting serial data from an arduino?;python
How to send Microsoft .docx file from Angular to Python backend without breaking it?;python
Get lastest values periodically in column;python
Using variables for longitude and latitude with google places API [closed];python
(Web2py) : List | Create | Modify and Delete Users directly from Python controller without using HMI;python
Flake8 links in PyCharm are incorrect and do not take you to the source code;python
CV2 Color to grayscale conversion for array of images ValueError: could not broadcast input array from shape (32,32) into shape (32,32,3);python
Scikit-image Regionprops Orientation value;python
Import functions in python files when the software is compiled with pyinstaller;python
AttributeError: 'Select' object has no attribute 'get_attribute' error using select_by_index() to select an option from dropdown using Selenium Python;python
Recursively going through list and compare with a value (python);python
ImportError when testing a local Azure Function (Python)?;python
Interpreting p values for Kolmogorov-Smirnov test, representing p values afterwards;python
How can I create a string that contains both single and double quotes python?;python
Why is a program not finding a library that's right in the same directory as the program?;python
Creating an instance of an object with an optional list type attribute;python
How to change yticks in the seaborn.distplot() from normalised values to absolute values?;python
RPi py-spidev threewire invalid argument error;python
Seaborn lmplot truncates trendline for some plots;python
summing up expressions in a 2d list- python 2;python
Django create a new record for each user every month;python
Key Error: cipher: ** pytube** Replacing signature cipher can not download highest resolution;python
Batch-wise training with ImageDataGenerator;python
pyspark aggregate while find the first value of the group;python
LEGEND in a 3D bar plot as a colormap;python
C++ / Django Login;python
What does model.setTable() really do in pyqt5;python
Can't install python pandas on Windows 10;python
Converting Pandas Series to Set splits values in series with commas;python
RxPy3 group_by creates “groupedobservables” but flat_map doesn't work - Reactive Python for Data Science Refactor;python
Does it make sense to train spaCy NER model twice?;python
Embedding tkinter GUI into ipython notebook;python
Extracting the codes (How do I edit the Script I get from the page source as I want?);python
Displaying z value in plot with pcolor: why it works for one of the two figure but not the other?;python
Why is a previously defined python variable still cuasing a “referenced before assignment” error? [duplicate];python
How can I count the max number of consecutive items (i.e. streak) and the number of “breaks” in Python or SQL?;python
Is there a way to scrape google article titles without getting ellipses in python;python
Insert a blank row between each grouping in a dataframe BUT only display the first header;python
Code to scan for new folders at a given path (network shared folder) [duplicate];python
Skip an object in class inheritance diagram with Sphinx.automodapi;python
Skip an object in class inheritance diagram with Sphinx.automodapi;python
Python Django NoReverseMatch Template;python
Load Tensor From Buffer using PyTorch and Tensorflow;python
Pygame error 'TypeError: argument 1 must be pygame.Surface, not list';python
Error in token, nonetype has no attribute strip in module;python
Tweepy: Get Number of Followers for List of Twitter Accounts;python
How to round float in pandas with many zeros?;python
