question;post_tag
JS Arrays — Reorganize 1D Array into 2D Array of N Groups Placing Values Sequentially;javascript
HTML Radio Button value assigned to JavaScript Global Query [duplicate];javascript
How to verify that field is greater than only if check on a specific button;javascript
Javascript Flex Slider shows expired images continuously, only shows correctly after I clear browser cache;javascript
How can I replace certain character when a user is typing on an input field?;javascript
How to pass parameter using navigation.navigate at a Functional Component to another Functional Component;javascript
v-navigation-drawer within v-content;javascript
How display each full hour on x axis (ticks) in google chart;javascript
Why the form is getting submitted even if all the fields are empty?;javascript
Asynchronous File Check in React;javascript
Why doesn't adding 24h worth of seconds to a Unix timestamp of right now give me the next day? [closed];javascript
How can I load an existing pptx file with PptxGenJs;javascript
Webpack require.context run function from default;javascript
How to return data instead of a promise? [duplicate];javascript
Vue ApexChart | How to implement my own custom tooltip to change the shape of the marker in the tooltip?;javascript
MongoDB filter docs on dynamic key and value using regex;javascript
Webpack: Ignore React Native Module and Load Web Module;javascript
JavaScript - send AJAX call on tab close (DELETE request);javascript
How to pass props from child component (addform) to main app component using programmatic routing in react.js;javascript
value is undefined when passed from child emit in vue.js;javascript
KonvaJs: Eliminate a group by id?;javascript
Clicking a button to update text in JavaScript;javascript
How can i change label “Sort by” in Vuetify's data table?;javascript
Bug of carousel on mobile phones;javascript
Refactoring difficult to read JavaScript tips and advice [closed];javascript
Different behaviour of executions with NodeJS `require` statements;javascript
switching from onKeyPress to addEventListener for KeyPress;javascript
how to concatenate string passing in an object?;javascript
Hot to remove top function log from function stack from js;javascript
How bot can find the speed of writing a person;javascript
input type text preview image;javascript
Require fix to script app to move an array from one google sheet to another on a trigger. either through a button or cell input;javascript
Typescript : sort an array according to a property which may be null;javascript
Moving a file from a React.JS frontend to a C++ backend;javascript
socket.io communication between two different client side js files;javascript
Hiding an element inside ul tag on window resize;javascript
Webpack external react causes React Hooks Error;javascript
the min value 40 and max value 60 in the function. how I can fixed that?;javascript
JS loop skips to last rectangle (using canvas) drawn on the screen [duplicate];javascript
GeoLocation history on Googlemap from array of coordinates from database;javascript
Using vue-sweetalert2 instead of sweetalert2;javascript
javascript - Altering w3 example table filter to support multiple text inputs;javascript
Horizontal scroll not working when swipe on touch devices?;javascript
How to change scroll speed to be smooth?;javascript
Looping through tables in tables in Java script;javascript
Node.js & Webpack, full restart when a new file is created;javascript
How can i program in Android studio that on click of the button write text on new activity and to open second activity;javascript
Input Type Time to select only hours;javascript
How to use ReactJS component inside kendo gantt chart;javascript
Dropdown items not showing when swapping input values between two autocomplete forms;javascript
Heroku Application Error (MODULE_NOT_FOUND);javascript
How to do React forceUpdate() to a child component?;javascript
constant variable is not use in react-native at release version;javascript
Sort Array of objects by number in specific order;javascript
How to get the value of result id to be stored in the database [closed];javascript
Save charts from Pivottable js in jupyter Notebook;javascript
Vs code create folder automatically with (dist) name;javascript
How I can change the font-family of labels in the bar chart?;javascript
jquery dropdown onclikc to hover not working in html website;javascript
Material UI: “Invalid hook call. Hooks can only be called inside of the body of a function component.” But no hooks are used;javascript
JS | Node.js - Divide a string into arguments considering quotation marks;javascript
Javascript --) Function Prototype 'this' variable [duplicate];javascript
i am facing 500 Internal server error! for a ajax code;javascript
getting singature for private API of a site;javascript
Month not correct when geting UTC month [duplicate];javascript
Node js api 400 Bad Request response for request from frontend JavaScript but 200 OK for request from Postman;javascript
the best way to split view between login page and dashboard Routing Vue js for SPA;javascript
Coinbase Pro API help to get portfolio balance;javascript
Javascript object unique ID with variable [duplicate];javascript
Javascript objects array;javascript
Meteor Collection fetch working after insert only;javascript
How many characters has the user deleted in WYSIWG element?;javascript
Set state using props in global variable vs componentDidMount;javascript
Issue with modifying polygon vertex position with pixijs using a simple slider range;javascript
Can't figure it out how to close a lightbox exactly by clicking on overlay;javascript
how to custom export filepath in amchart4;javascript
Document.querySelector returning a null value [duplicate];javascript
Dynamic material ui drop menu;javascript
What charts library should I use with Node / React stack that allows adding lines on chart (as in the picture below)? [closed];javascript
How do I mock azure-storage table service functionality with jest?;javascript
How do i revert a fuction after a timer in Javascript;javascript
Trying To Make A Check Box “Force” 2 text fields to be overwritten;javascript
Filtering nested array using multiple conditions;javascript
Sending Complex Objects to Controller with Ajax;javascript
Show loader element until page loads, then hide it;javascript
How to improve this type?;javascript
How to properly start application mainly with JS [closed];javascript
php dynamically change button or link based on completion of exe file (15-20sec);javascript
Unable to Utilize Web Component created using React Js in another project of react js?;javascript
How to validate username field using Formik and a graphQL query;javascript
How do I make my js file works for both ES6 modules and normal js?;javascript
Discord bot kick;javascript
Updating the forms in react js doesn't keep track of the state of all the props;javascript
Material UI styling the onFocus Select component;javascript
JavaScript Remove() The last input appended onto the dom;javascript
How to return a single object from an array in Javascript to another variable?;javascript
Svelte bind is not working when customElement: true is set;javascript
Not able to update a class property in ES6;javascript
How to find the duplicate values dd/mm/yyy in html table using Javascript?;javascript
How to show multiple input fields using onchange function?;javascript
constantly get the log output from a website;javascript
Is it possible to run JavaScript on Gmail?;javascript
Did anyone manage to cluster over 1 million points on map?;javascript
How do I dynamically import images in React?;javascript
When returning value from flask, using AJAX, it says [Object, Object];javascript
Replacing alpha inside rgba issue;javascript
Performant way of combining fees;javascript
Cannot find module '../../images/Logo.png'.ts(2307) Red Error is Still showing;javascript
How do I dynamically import images in React?;javascript
D3 - Data binding from two different arrays;javascript
Using Handlbars and want to create a button to render a div within that template;javascript
Accessing properties of an object in a function which is inside of that object [duplicate];javascript
Apps Script DriveApp Error: “We're sorry, a server error occurred. Please wait a bit and try again.”;javascript
How to close a modal window clicking outside in React + Redux app?;javascript
How to make vue-cli-service fail if one of the process.env.VUE_APP_* environment vars cannot be resolved;javascript
I do not see elements added with react.js in the browser;javascript
I do not see elements added with react.js in the browser;javascript
How to enable debug mode by generating service worker file from workbox cli?;javascript
Cannot use import statement outside a module when running protractor;javascript
Having an issue with blur function from a course lesson in javascript;javascript
Using Morgan in Node;javascript
How do these variable assignments make this Fibonacci loop work? [closed];javascript
how to create new sheet in excel with javaScript?;javascript
How to use THIS keyword for functions that don't have an action in JQUERY;javascript
Add arrow functions to table cells with row and column as parameter;javascript
Why do these checkboxes work in Safari but not Chrome or Firefox?;javascript
How to convert new Date() to UTC date using moment JS;javascript
How to turn a percentage into such a number?;javascript
My loop is not moving on to the next element in array;javascript
Javascript - prompt input on div element;javascript
Print table information after onclick event in Django;javascript
D3 - Data binding from two different arrays;javascript
React native flatlist feel so slow when List contain Images;javascript
Array of objects values to array;javascript
Sorting array of arrays of objects by value [duplicate];javascript
Split String and move to newline in JavaScript;javascript
typeError - element is null in javascript [duplicate];javascript
Call next() when the data is fetched;javascript
How to send cookies when testing Socket.IO with Mocha + Chai?;javascript
Nestling error or the action navigate with payload was not handles by any navigator;javascript
Most efficient way to grab the unique JSON object in an array;javascript
I am using lint with angular2+, How can I sort the constructor parameters alphabetically?;javascript
How do you get a django model instance from an Angular select dropdown field containing a django-rest-api field with a foreignkey?;javascript
explanation function with parameter e;javascript
Move div with click and drag;javascript
Illustrator: Getting stroked colorCodes from 'javascript' opened PDFs;javascript
Client side Handlebars populating template with data from API;javascript
JS, correct syntax from arrow to normal;javascript
Is it possible to disable all alerts() in page;javascript
Refresh D3 chart everytime on change in textarea data;javascript
Is “Javascript” term used correctly now? [closed];javascript
Regex to find concatenation caracter between string;javascript
Change content when tab is clicked in a dynamic way;javascript
How do i add vars together in a function? [closed];javascript
How to await value in localStorage [duplicate];javascript
Building your own Timer in React [duplicate];javascript
click event not working with every div elem [duplicate];javascript
Avoid collision in Bubble chart;javascript
How can I exit a javascript form validation without executing the form action?;javascript
Replacing HOC setState and callbacks with functional components Hooks in React;javascript
Wrapping a react-bootstrap component Typescript error;javascript
navbar-toggler isn't working/bootstrap navbar doesn't toggle;javascript
my sapUI5 app only jumps once into my print method;javascript
I am having Trouble Mapping a created array in React and am trying to spread it (but to no avail);javascript
Post request body is empty on server side Meteor (Error 503);javascript
transform property css not working with js [closed];javascript
Variable Scope in a function;javascript
Variable not being assigned value out of function;javascript
How to use Puppeteer with Stripe Elements;javascript
javascrip sort array of objects with different keys;javascript
Node JS How to transform Json response to HTML page in Node JS;javascript
Apply href on image, class or id;javascript
Display an array of objects in a table format using strings (NOT HTML);javascript
Why should js function's name starts with a capital letter;javascript
Trying to move the video feed to the far left of the webpage;javascript
Upload multiple files at once in React using multer and Node.js;javascript
how connect to azure blob storage using java script;javascript
How to declare efficiently a set and get functions for handling cookies in modern JavaScript with ES modules?;javascript
Show fields only if file was uploaded;javascript
Assign the same array object to multiple variables? [duplicate];javascript
stop calling the function repeated while checkbox is clicked;javascript
how to send data from component to worker on button click?;javascript
React testing library: test failed style (Select + Form Control from MUI);javascript
HTML/Javascript Problem Displaying Local Storage Values;javascript
Javascript Webpack - can __webpack_public_path__ be set after runtime is initialized;javascript
Why am I obtaining this strange behavior trying to use different color for different event type dragged into a PrimeNG FullCalendar component?;javascript
Function to recursively rewrite JSON tree, turning any arrays of 1 item, into an object;javascript
Using TSDX with Multiple Entries;javascript
Typescript import are missing the .js extension when it compiled to javascript;javascript
react router not working with parallex unless i refresh;javascript
Node Js + MongoDB Getting old data from DB;javascript
setTimeOut best approach when customizing UI;javascript
native base (Input) with a line;javascript
How to add/limit 2 decimals .00 in the input field of type number in Angular 7;javascript
How to create dynamic array and variable in JSON data?;javascript
What's the difference between the two coding style?;javascript
Get ajax/XHR response time;javascript
How do I call a method recursively in AlpineJS?;javascript
Reset (index) to 0 when changing tabs;javascript
How insert item in tree recursively;javascript
How do I save a file on iPhone from a responsive web site;javascript
When am I considered ready for internship ? python [closed];javascript
My firebase cloud function tells me: Function execution took 60004 ms, finished with status: 'timeout', but why? What is wrong with my code :(;javascript
Finding Chart type;javascript
algoliasearch() has no signature call;javascript
Don't have permission to open/view a file on a Nativescript App;javascript
Dynamically change select options when using a Python list in Flask;javascript
How to convert table data to an object and have headers as keys;javascript
Add delete event inside delete button to each row of Datatables on Angular and add background-color into button;javascript
How to see all form validation error messages in a sweetalert instead of message “please fill out this field” - Jquery;javascript
JS Countdown Timer Stoping at Zero;javascript
ScrollLeft not working in react with ScrollContainer;javascript
How to create select tree in js? [closed];javascript
Getting error in JavaScript(jQuery) code in React Application;javascript
run script directly from mail;javascript
React Infinity scrool : TypeError: Cannot read property 'offsetTop' of null;javascript
CSS changes when copying and pasting?;javascript
How to avoid multiple for loops;javascript
How to scroll multiple elements together in reactjs using one elements scroll to another element scroll;javascript
D3js filter table;javascript
How to redirect to a home page after successful login using signInWithRedirect(provider)?;javascript
Split string with commas but ignore the ones within double quotes [duplicate];javascript
How to reestablish events after socket timesout on the client side;javascript
tfjs-core reference suddenly stop working and shows “No backend found in registry.” error;javascript
How to scale and change state of original image on fabric canvas?;javascript
ES6 module, what counts as the first import?;javascript
Can I use relative path with webpack dev server - react js;javascript
HTML, how to get exact text in viewport (not just p tags that overlap with clientRect)?;javascript
Unable to get google recaptcha token in mounted() in vuejs + laravel;javascript
Problems with selecting objects from a group;javascript
Why cant I return a value from a setTimeout function inside another function? [duplicate];javascript
parse data to CSV send email use nodeMailer Node.JS;javascript
Vuetify Add Button to install app on Homescreen;javascript
How can I restrict results to exact match when jQuery .match() is returning partial match from list items?;javascript
How to add path to map with openlayers? [closed];javascript
Input text dissapears after uploading image;javascript
React-native flatlist is sharing props between components on isLoading;javascript
Value update if object exist and create if not under array mongodb;javascript
cannot change height of a svg group element with javascript;javascript
Strange value begin inserted at the beginner of query string on Node URL request;javascript
How do i set and get the different states and inputs from a flatlist with multiple objects;javascript
how to apply css to material-ui Listitem component based on the activeStyle of navlink in react-router-dom in react js;javascript
Anonymize Form Inputs on Form Submit;javascript
Remove elements from javascript object with list of keys [duplicate];javascript
Setting variables in if statement using JavaScript throw error (already declared);javascript
HEADERS CANT BE SET - Cannot find where this issue is coming from;javascript
How to get style attribute of iframe from inside of that iframe(javascript);javascript
How to build a drag and drop hierarchical tree that automatically updates;javascript
Max number of script in a spreadsheet [closed];javascript
Redirecting links to mobile apps instead of browsers;javascript
automatically declare the variable each time it is run?;javascript
Json returns the object as undefined;javascript
Wondering how to use Python within Node.js / Electron;javascript
JavaScript, Submit button check if an input is empty;javascript
Javascript Closure with setInterval() in React Hook;javascript
How to pass the value of observable to const/let variable in angular;javascript
Javascript OnSnapshot listener for creation when document doesn't exist;javascript
activeClassName in Navlink not rendering the active class to the anchor tags;javascript
Pass JS output into a DB via Flask;javascript
Uncaught (in promise) DOMException: Unable to decode audio data from pyAudio to JavaScript;javascript
Bundling react framework with rollup into multiple chunks loses reference to ThemeProvider;javascript
Typescript: TypeError: Cannot read property 'yc' of null;javascript
hunspell_asm__WEBPACK_IMPORTED_MODULE_0__ is not defined;javascript
Upload files with ajax and javascript;javascript
confusion about this React custom hook usage;javascript
How do I replace a file on firebase storage bucket?;javascript
Deployment of WAR file fails in Jboss EAP 7.0.6;jboss
User with admin right is not able to claim or complete another user's task in jbpm;jboss
JDeveloper Weblogic server Default Domain Creation Issue: Problem invoking WLST BuildDefaultDomain1.py;jdeveloper
Is there a way to fetch build or jobs directory path in jenkins;jenkins
Jenkins SSH From Windows Server To Linux Server;jenkins
Hi Everyone, I want generate apk using jenkins;jenkins
Jenkins: Passing environment parameter without affection previous build branch;jenkins
is there a Solution in jenkins to limit characters input for a TEXT parameter?;jenkins
How to get multiple input parameters using input function at same time in jenkins pipeline;jenkins
SCP from Windows to Linux using Jenkins pipeline script;jenkins
Jenkins credentials API error “Nothing is submitted”?;jenkins
OATS integrated with Jenkins;jenkins
Jenkins slave configuration issue in linux;jenkins
How to set default value for Active Choices Reactive Parameter plugin in Jenkins?;jenkins
Managing webhooks in Bitbucket Server;jenkins
Using Building Blocks in Jenkins Declarative Pipeline;jenkins
The Jenkins tunnel address which I specify in the Jenkins-)Configure Cloud does not seem to work. Can someone help me with the same?;jenkins-pipeline
Bat job not returning returnStatus when being run inside a jenkins pipeline script;jenkins-pipeline
jest how to see all uncovered lines in CLI?;jest
Testing that Vuex action was called with specific argument (from component);jestjs
jetty ShutdownThread memory leak with spring batch;jetty
How I will delete one of my project from JIRA?;jira
JMeter allocate and mapping of data across users;jmeter
JMeter HTML Report Dashboard - Number of Total Errors is greater than Number of Total Samples;jmeter
Unable to make HTTP REQUEST successfully from jmeter when on VPN;jmeter
FABRIK : how to hide elements use dropdown element;joomla
How can I modify Edm types in olingo by mapping in Olingo;jpa
select value from subfield that is inside an array;jq
JQuery Ajax Post Data for odata web api;jquery
How to insert the newly Created HTML String just after the (/header) section;jquery
jQuery: Animate (Expand/Fill with image) FontAwesome Icon on Scroll;jquery
Show modal after clicking on a photo taken from external API;jquery
jQuery .ready() function runs before iframe is loaded;jquery
Laravel response ids change when response is json but when dumping the data the ids are there;jquery
Increment of input type number appending number instead of incrementing;jquery
jasmine test for http response of type application/pdf;jquery
posting form when submit is actually override in jQuery;jquery
What is reason behind occasional functioning of jquery?;jquery
How to handle bootstrap 4 collapse within a collapses;jquery
Gutenberg/WordPress - Switch button to add block and ACF metaboxes;jquery
using if or statement on multiple ids if change occurs query;jquery
Jquery footer reveal with animated navigation list;jquery
JQuery check the presence of an attribute;jquery
jQuery: resize images and set as values for input type hidden field;jquery
Call an object from another page with $.get;jquery
Loading third party from manifest in SAPUI5;jquery
Install Jquery Datatables and its plugins using NPM and Laravel-mix;jquery
Creating a Jquery function that can tell if a YouTube channel is live;jquery
Fixed element - Not staying fixed due to plugin [duplicate];jquery
How to make Jquery mobile app recognize a user?;jquery
Jquery ajax - A cookie associated with a cross-site resource at was set without the `SameSite` attribute;jquery
My table sometimes loads in 5 seconds, sometimes loads in 30 seconds, why? (jquery);jquery
close sidebar by default . Bootstrap;jquery
How return value string is null from an ASP.NET MVC controller?;jquery
I am a beginner and my AJAX code doesn't work;jquery
jquery datatable SearchPanes pagination state not maintains;jquery
Is there any way to check if all images in slick got loaded?;jquery
Why does AdminLTE side menu url not working;jquery
Add button is not calling colorselector through wapper append;jquery
Pass Jquery slider values to asp.net MVC controller without using ajax call;jquery
How can I get an array of values from a list of checkboxes, and send these values to a controller action using AJAX?;jquery
Delete script based on comparison;jquery
is there any way to bind the lightgallery images in descending order?;jquery
How to make sure that kendo grid detailInit can be called everytime;jquery
Display a property in the suggestion using twitter.typeahead bloodhound;jquery
how to replace folder name before last right slash by jquery or js (substring?);jquery
Partly raw html in live preview (jQuery);jquery
Dynamic Drop down menu using Thymealeaf and database throw exception;jquery
Does serializeArray sanitize input before being passed to eval?;jquery
How to sort order like last item displays first page last item using jquery datatables?;jquery
Autocomplete load Json onSelect;jquery
having a hard time removing class when a sibling is clicked;jquery
change the order off divs with same name using jquery;jquery
Margin or padding in jquery chosen;jquery-chosen
Wicket Select2 on change listener;jquery-select2
JQUERYUI: Modal buttons dont work when I close and open;jquery-ui
Debugging a Expression Language (EL) in a facelets file (XHTML) on IntelliJ;jsf
Redirection calls in same browser tab JSF2.0 [duplicate];jsf
Whole form updates when dialog box opens in jsf primefaces?;jsf
JSF webapp running in GLASSFISH is not working in TOMCAT [duplicate];jsf-2.2
Remove a specific JSONObject from JSONArray in groovy;json
Where is this Parse Error In Google Calendar API;json
add last item from Json array;json
json.Unmarshal Ignore json string value inside a json string, dont attempt to parse it;json
Actualize DevExtremData Source;json
request has been deprecated, see https://github.com/request/request/issues/3142;json
spring Rest json response format;json
How do I update an eloquent json column from validation data without over writing what's stored in the column?;json
JSON: Serializing DataRow into parent object;json
How to combine multiple JSON Objects in Informatica Developer?;json
cannot send Arabic text in post request;json
How to leverage JSON validation and syntax highlight;json
How to create multiple DataFrames from a multiple lists in Scala Spark;json
mockwebserver insert json gives back 1 character;json
How to create a custom POJO for Apache Flink;json
Which file format json or xml or else is better to use in Qt C++;json
