question;post_tag
Removing Double Or More Slashes and “str=”;.htaccess
Protected directories and IP white listing;.htaccess
I converted my htaccess to nginx, can someone confirm?;.htaccess
301 Redirect root without cascading new root directory to all other 301 redirects;.htaccess
Masking url to show content from different domain;.htaccess
.NET CF 2013 with SQL questions;.net
ASP .NET Core 2.2 How to keep connection between client and api even if user closes your card site in browser?;.net
How to initialize a SQL Server docker database with seed data?;.net
Async Stream to WebAPI;.net
How can I add list values to etcd;.net
How to parse given string to DateTime?;.net
Will AWSSDK 2.3.55.2 for .Net fail with API Signature v4 check enforcement?;.net
How to make Entity Framework ignore DBSet (.net core);.net
Hot to setup Azure Functions with custom Application Insight(Instrumentation key)?;.net
Network Printing without local install?;.net
SQL Server Management Studio Unable to Start Correctly;.net
Git ignore is not working for some files/folders for .NET core files [duplicate];.net
ReactJs and admin panel(in MVC) in one project;.net
Associate .Net WebAPI logging to Azure;.net
Azure DevOps yaml restore packages to specific directory;.net
How to split by carriage return (vbCr) and it still keep it in the final string array?;.net
Hosting Windows Form Application in IIS;.net
Kept running into 401 unauthorize response using .NET Core v3.1;.net-core
Keyword not supported: 'initial catalog';.net-core
Installing specific dotnet version in azure;.net-core
Console App Without External Dependencies;.net-core
How to better use streams in order to chain them?;.net-core
Odata.bind error when creating a team with microsoft graph;.net-core
Using postman to post dictionary;.net-core
Console App Without External Dependencies;.net-core
.NET Web API Stripping Slashes from Controller Name - How to disable that behavior?;.net-core
How to Inject dependencies when using MethodDecorator.Fody;.net-core
Can Not find Button & gridview Control in Toolbox In .Net Core WinForm App;.net-core
Costura.Fody not working for .NET Standard library;.net-standard
Connecting PyQt5 with pygalmesh for 3D rendering?;3d
Cocos Js - How to detect touch of 3D object;3d
I am using the code below and works great on a 32 bit system but not on a 64 bit maching running Office 365. How can I run on both;64-bit
7Zip Over Network;7zip
What does the full scale range in a IMU MPU9250 datasheet signify and which is better to use?;accelerometer
What algorithm can I use to count steps using Accelerometer and Gyroscope?;accelerometer
What algorithm can I use to count steps using Accelerometer and Gyroscope?;accelerometer
Change in Balance calculation - MS Access;access
(legend) tag is not read by Windows Narrator;accessibility
Delagation on all modules;acumatica
gm/Id design characteristics;adc
cq:showOnCreate not working with RTE on Page properties;aem
Spatial sound on entity with aframe.js and howler.js;aframe
exporting of ag-gird table result in a blank exported file;ag-grid
ServerSideRowModel - Remove filters and sorting at once without causing calls to `dataSource.getRows` twice;ag-grid
ag-grid dynamic row content;ag-grid-angular
Agora RTC - Agora-SDK [DEBUG]: Ignoring event undefined;agora.io
Airflow worker queue on ECS;airflow
How do I pass the task_id name dynamically in the Dynamic DAG creation;airflow
Airflow - External task sensor running on different hour;airflow
ASP.NET MVC CORE Batch POST;ajax
The request of the uploading files canceled after chrome last update Version 83.0.4103.61;ajax
Why tag is showing as string in select2;ajax
Why do it throws a 404 error when user sign up by mail using Mailchimp embedded form with AJAX to block the redirection?;ajax
Ajax returns Authorization HTML instead of json object;ajax
Django Rest Framework with AJAX;ajax
Shopify Predictive Search Ajax Call;ajax
Encoding in strings in python;ajaxform
Question on RAFT log replication - Use case for leader forcing log sync by deleting extraneous entries in the follower node;akka
How to use async functions within Alexa skill properly?;alexa
Topics in Programming Based Mathematics [closed];algorithm
Implementation of genetic algorithm in spark;algorithm
Miller - Naor Algorithm for calculating maximum flow for multiple sources and sinks;algorithm
how to prove given set of clause unsatisfiable using resolution method {A, ¬A}, {¬A, ¬B, A ∨ B};algorithm
Plane Sweep Algorithm - points lying outside the disks;algorithm
Matlab: Split one market in to two, by using coordinates and nearest neighbor algorithm [closed];algorithm
Recognize symbols on a scanned/shot document;algorithm
remove duplicates transactions before using the Apriori and FP-Growth;algorithm
Does anybody know what algorithm Google Charts uses for their Histogram Buckets? [duplicate];algorithm
Is there a way to code Verhoeff's algorithm in python? That is easy to understand;algorithm
Where can I find implementation of popular data structures? [closed];algorithm
How to find minimum route with 3 variables;algorithm
Optimizing the algorithm to run under 4 seconds for a quite large number of operations;algorithm
Implement of an ADT that supports the following requirements;algorithm
I keep getting the error “Index exceeds array bounds”;algorithm
I need help to optimize a function;algorithm
Is the height of a binary tree log2(n);algorithm
How to compute time complexity when using a mod operation;algorithm
Algorithm for calculating position numbers for nested list elements;algorithm
How to approach the sorting based algorithm/ undertstanding the intuition behind the code?;algorithm
How to find rating in a 1v1 match based on the score?;algorithm
Alloy : Restrict values of a String field;alloy
Custom payment via voice assistant apps;amazon
How to combine items with Fn::FindInMap that returns list?;amazon-cloudformation
Cloudwatch insight grok extract json as field;amazon-cloudwatch
Cypress AWS Cognito Intergrations;amazon-cognito
enable server side encryption for dynamodb using cloudformation yaml;amazon-dynamodb
AWS Scan ignores withLimit();amazon-dynamodb
Does DynamoDB charge for the table deletion?;amazon-dynamodb
Making one large table in DynamoDB from Small Tables in MongoDB;amazon-dynamodb
Why choose RDS/Aurora over EC2 instance on AWS, or choose CloudSQL over Compute Engine (VMs) for database server?;amazon-ec2
Running Binary on EC2 Instance Start;amazon-ec2
How to do port forwarding from EC2 public IP to another EC2 IP?;amazon-ec2
EC2 host type for a DynamoDB batchWrite call;amazon-ec2
ECS with Route 53 Service discovery;amazon-ecs
Amazon Lex - Barge In;amazon-lex
logstash mutate gsub for s3 special characters;amazon-s3
Need a way to call multiple templates in a json email template document and send-templated-email api in AWS SES;amazon-ses
Best cloud computing options for web mining a lot of data in parallel? [closed];amazon-web-services
AWS CDK how to create an API Gateway backed by Lambda from OpenApi spec?;amazon-web-services
Do i need to unmount an EBS Volume in AWS when shutting down the ECS Instance?;amazon-web-services
Register-ScheduledJob as LocalSystem user;amazon-web-services
Hooks in Elastic Beanstalk V3.0.1 (Amazon Linux 2) for configuration updates;amazon-web-services
Data migration from Azure CosmosDb to AWS DynamoDB [closed];amazon-web-services
when calling the EnableAWSServiceAccess operation: You specified an unrecognized service principal;amazon-web-services
AWS crontab not working on Amazon Linux 2/3.0.1;amazon-web-services
What are uppercase and lowercase letters in AWS Cognito password requirements?;amazon-web-services
User Logging automation via Cloudwatch;amazon-web-services
Terraform recreates the autoscaling permission when upgrading EKS cluster version;amazon-web-services
AWS Cognito Google Identity Provider Get Profile First & Last Name;amazon-web-services
CircleCI script to test against DynamoDB Local Fails;amazon-web-services
how to add field or column in dynamoDb using console;amazon-web-services
Run multiple fargate task with step function;amazon-web-services
AWS CLI Find All Security Groups which Contain a Rule Allowing All Traffic from All Sources;amazon-web-services
How to install SSL certificate for domain and subdomain;amazon-web-services
“Missing credentials in config” error when using amplify Auth.currentCredentials();amazon-web-services
How to make AWS Lambda work reliably with Neptune over websockets?;amazon-web-services
AWS + Springboot + Microservices + Elastic BeanStalk + API Gateway + DynamoDB;amazon-web-services
How to use Cognito LOGOUT endpoint to really log out?;amazon-web-services
Flutter JSON encode is not supported by AWS? (Database: DynamoDB);amazon-web-services
Connect S3 via NIFI without credential;amazon-web-services
Passing dynamic host from one role to another role in Ansible;amazon-web-services
How to reduce RDS cost for Audit data on aws;amazon-web-services
How to use github action to deploy a serverless mono repo with multiple packages.json?;amazon-web-services
Using AWS API Gateway for private APIs, is it possible to have a single endpoint that is configured to be public?;amazon-web-services
Running ML preprocessing job in AWS;amazon-web-services
Am I able to move my docker repositories or images from Amazon ECR directly to another ECR repository on a different account?;amazon-web-services
SPARK on EMR Container from a bad node;amazon-web-services
CloudFormation S3 Bucket Policy invalid action error;amazon-web-services
AWS Vue Amplify - PreBuilt Sign-Out Component Missing;amazon-web-services
Fargate does not work with VPC Endpoints, works without;amazon-web-services
Redshift timestamp timezone;amazon-web-services
Get all the data from amazon cognito;amazon-web-services
CodePipeline, CodeBuild, CloudFormation, Lambda: build multiple lambdas in a single build and assign their code correctly;amazon-web-services
AWS private static ipv4 for application load balancer;amazon-web-services
terraform: is there a way to create iam policy statements dynamically?;amazon-web-services
How to show the accumulated bar plot in AWS QuickSight;amazon-web-services
AWS API Gateway - Custom Domain - Unable to complete operation due to concurrent modification;amazon-web-services
HTTP REST: OK to return different keys in response body depending on response size?;amazon-web-services
Amazon SQS deletes message before Lambda function fetches it when using an SQS Lambda trigger;amazon-web-services
What is the AWS perfect substitute for Azure SignalR Service?;amazon-web-services
Failed to create service linked role: AWSServiceRoleForAmazonEKSNodegroup due to missing permissions for 'iam:CreateServiceLinkedRole;amazon-web-services
Can I view an available message that isn't receivable in a Fifo queue;amazon-web-services
What options are available within AWS API Gateway to authenticate on-prem client requests to private APIs?;amazon-web-services
TypeError: AWS.PinpointSMSVoice is not a constructor;amazon-web-services
Is there a way I can protect certain tag Keys from deletion in AWS?;amazon-web-services
AWS Athena select query to fetch error code from status column;amazon-web-services
AWS: Push Noification - PushNotification.onNotification is not working in react native;amazon-web-services
Each wild card sub-domain points to different IP address;amazon-web-services
How can I use two API Key to authorize two graphql fields separately in Appsync?;amazon-web-services
When a task turn ECS does the docker run in detached mode or Foreground mode;amazon-web-services
Attach EBS Volume to EKS Cluster nodes;amazon-web-services
Determine and update the openssl version on AWS Lambda;amazon-web-services
How to Detect if a Powered Down EC2 Instance will have an AWS Public Pool IP When Powered Back on;amazon-web-services
Lambda function on AWS to send notification before EC2 shut down;amazon-web-services
Rate Limit on S3 bucket;amazon-web-services
Export current VPC infrastructure;amazon-web-services
Spark job failing while writing to aws s3 bucket -;amazon-web-services
SSH back to AWS Lightsail after UFW enabling;amazon-web-services
Change datacapture encoding data to csv;amazon-web-services
How can my EKS web application retrieve the current user authenticated by AWS Application Load Balancer through OKTA OIDC;amazon-web-services
aws delete reports group history;amazon-web-services
AWS Elastic Beanstalk won't deploy my Rails app even once;amazon-web-services
Deploying MVC application on AWS (.NET CORE 3.1) - Error: Environment must have instance profile associated with it;amazon-web-services
Can simple email service in aws used with route 53;amazon-web-services
Different MD5 hash for same string (CryptoJS.MD5);amazon-web-services
Would ElasticSearch sometimes failed to return a document in a key based range query sometimes;amazon-web-services
External offset store with the debezium embedded connector;amazon-web-services
How to differentiate logs from a docker container running in different environments in cloudwatch logs;amazon-web-services
How to delete a DNS record in Route53 via aws cli?;amazon-web-services
AWS EC2 ) IGW Outbound Traffic Filtering by Domain or URL;amazon-web-services
Selling partner Aws Sign4 wrong calcualation for vendor;amazon-web-services
AMCharts Maps v4 - colors in a heatLegend on resize?;amcharts
Can you build a standalone AMP site?;amp-html
Anaconda 3 Spyder Version 4.0.1 corrupted, cant installl v4.1.3 completely;anaconda
Detect gyroscope has stopped its motion;android
Unresolved reference : isInitialized on lateinit property;android
Wi-Fi P2P From Linux to Android;android
Android CountDown Widget;android
How to set quantity text in bold style in text view from R.plurals.cats in android;android
Visual studio 2019 android break point not work;android
No bean found when using koin in non-activity class;android
Upload Video From Android App Using Youtube Data V3 Api Error;android
Recorded videos with MediaRecorder play only the first frame in Samsung devices;android
Cause: invalid type code: 69 Android studio while building;android
How to Get image to new Activity in Recyclerview item click method;android
Is it possible to receive an event when a whatsapp call is received?;android
Getting “App Not Installed” message after attempting to install new version of Android app;android
How can i waching Android App Crawler test results?;android
Admob's new way with setTestDeviceIds() for test ads not working;android
Could not download backport-util-concurrent.jar (backport-util-concurrent:backport-util-concurrent:3.1): No cached version available for offline mode [closed];android
java.lang.IllegalStateException: recyclerview_latestmessage must not be null;android
How to fix picker dialog that is cutoff in smaller screens?;android
Android - How to retrieve SQL-format date time regardless of Phone Calendar setting (Weird characters issue);android
Could not download backport-util-concurrent.jar (backport-util-concurrent:backport-util-concurrent:3.1): No cached version available for offline mode [closed];android
Expo camera recordAsync works on iOS but not Android;android
Stop overlapping Android Audio Notifications;android
MediaStore Cursor showing Deleted (non existing) Data;android
Getting Fatal exception on different Android devices using RushORM database;android
Showing Image in ImageButton;android
Android Manifest: Can't force minSDK anymore. “should not be declared in the android manifest file”;android
how to fix type '_CompactLinkedHashSet(String)' is not a subtype of type 'Map(String, dynamic)' error;android
How to get id when onitemclick listener for spinner in android;android
Request location updates base on Activity Recognation API not work as expectation;android
in xcode auto select the real device when connected to laptop;android
Best searching library for mobile database;android
Agregar evento a CalendarView;android
how can we build android ndk from android code base;android
While launching AVD in emulator showing this “Unable to locate adb”;android
Migrate from fileprovder to storage access framework;android
Kotlin extract information from JSON retrofit response and map them to Textview;android
Parceler + Realm + Kotlin: error: cannot find symbol;android
Open an Android Studio project in a new desktop;android
Flutter: Android “network-security-config”;android
Can I save data in SQLite database without using loop or any other technique?;android
Inserting printk calls in Linux kernel XHCI driver results in ENOMEM errors?;android
How to delete specific key from all the child nidra in fire base android;android
Hi, I try to select files from storage or downloader outside of my application;android
Font Chage in QML UI;android
Stuck with ArrayAdapter;android
Observer stops receiving live data updates when Fragment resumed;android
React - error: package expo.modules.updates does not exist;android
Android standard font used to differentiate between capital i and small l;android
How to check if required permissions are granted for another app with PackageManager/PackageInfo/Permissions?;android
Body request with multipart;android
how to solve same dpi problem with different screen size;android
How to Inject Other Dispatchers to MainCoroutineRule?;android
No (dialog) in Android Navigation;android
on tap of minicontroller is not taking to extended controller in android chromecast;android
ExceptionInInitializerError with retrofit api request;android
OnBackPressed() doesn't work properly in BottomNavigationView;android
Android 10 Font Issue [closed];android
APP development - best practices - A way to create an adress search / database [closed];android
Recover deleted files, not the cache copy on Android;android
Fragment not getting loaded in main frame. on api call through retrofit in Android;android
The interaction between the two devices. ANDROID [closed];android
Adding ripple animation in android [closed];android
Why In-App Upgrade is Not Working? Why its not going to onSuccss() method?;android
How to call another file included or main.dart file include function insider the `the MyApp();android
Android EdgeTreatment for MaterialCardView on API 28;android
A error from a onRequestPermissionsResult;android
RN view over android native activity;android
Material TexInputLayout change color [duplicate];android
InApp messaging not showing [closed];android
Can i test lte signal monitoring app on virtual device in android studio?;android
Why Iperf3 external lib not works in Android Q;android
Getting the value of the toast message and storing it in a string;android
Execution failed for task ':transformClassesWithDexBuilderForDebug'. I can't build my Ionic Cordova app;android
Why is mapPadding Prop not giving any padding on iOS devices when padding is specified?;android
Asynctask to open a web page in background Android Kotlin;android
Error when updating retrofit2 to the version 2.9.0 from 2.6.0 seems to confilct with Firebase;android
Android able to connect to Bluetooth device even after turning off bluetooth on Pixel 4?;android
Disabling auto-fill OTP on EditText Android [duplicate];android
The Calendar.set(field,value) doesn't set the hour properly;android
Managing server for management of content in firebase;android
can't get imageUrl of profileUser when I'm logging the firt time in firebase Android;android
Calling Parent Fragment function in DialogFragment [Kotlin];android
Android Studio 4.1 ANDROID_AAPT_IGNORE;android
androidX Recyclerview Clickable [closed];android
TextInputEditText loses focus after it gets it after request;android
How can I make a button open a specific page in PDF file which is on assets in android studio?;android
Google cloud translation api;android
React Native project can't be open with android emulator;android
How to dyniamically check if the smarthphone is connected to the internet? [duplicate];android
Flutter: Accidentaly created my whole UI on 360x780. How can I make it to be evenly resized on other phone screens?;android
How to detect video is Vertical or Horizontal in ExoPlayer;android
Only the original thread that created a view hierarchy can touch its views when using Dialog [duplicate];android
Project Structure in Android Studio shows errors over errors;android
check foreground on selected items android;android
I need to add alpha on image using paint brush in android;android
SHA1 fingerprint from signing certificate vs Upload certificate vs debug certificate (Firebase);android
Delphi Rio 10.3 - Missing profile name when compile my first Android application;android
How do to hide an attribute in a spinner in android?;android
Facing `WorkManager is not initialized properly` after migration to Here SDK v3.15;android
“Superseded by production” prevents testing of Alpha release of Android Xamarin app when version code appears to be higher than production;android
Android coroutine viewmodelscope cancel;android
receive data in Raspbery Pi 4 with Android and BLE [closed];android
Onitemclicklistner for spinner how to get the id of the key in android;android
android RecyclerView adapter notify item removed at position with viewModel;android
MSI SDR device sample code does not compile;android
com.google.firebase.database.DatabaseException: Can't convert object of type java.lang.String to type com.example.noalumni.model.Users;android
Mobile emulator/simulator Detox screenshot artifacts differ when run on different hosts;android
Get string resource name from TextView's text;android
onDataChange request save cache data Firebase Realtime Database;android
Lower navigation bar still showing in immersive;android
Disable sticky headers in recyclerview;android
How to get rid of Unwanted Rectangular App Icon on Android;android
App language does not change on API 19 programmatically;android
Android Intent / Start Activity Issue;android
Edit text is loosing focus automatically in xamarin Android;android
Ionic - Failed to fetch plugin via registry;android
How to catch the number of the page that i'm in? ViewPager React Native;android
How to use Material theme with transitions only for some activities in an android app?;android
Using ContextCompat.getColor in fragment Kotlin?;android
Getting root element must be well-formed. error in android build;android
Android studio fails to initialise UI editor;android
When click notification, go to Mainactivity and resume the task (Countdown timer should continue) Android Studio;android
I have 2 problems that I can not solve and do not understand why , someone can help me?;android
How to make synchronous API call in coroutines?;android
Flutter Firebase Matching user data;android
How to make a video which can play/loop infinite times using FFMPEG command in Android?;android
Ionic capacitor Android app cannot access internet;android
How do I read and write binary files using the NDK and the AssetManager on Android?;android
Error while adding SHA-1 key to firebase “An OAuth2 client already exists for this package name and SHA-1 in another project.”;android
I got “ Error Unable to invoke no-args constructor for class CLASSNAME” with Parcalize;android
Is it possible to pass Build Config parameters via ./gradlew command?;android
GoogleSignIn.getLastSignedInAccount returns null after GoogleSignIn.requestPermissions;android
Fully managed enrollment with Android Management API on active device;android
Could not identify launch activity: Default Activity not found after upgrading to Android Studio 4.0;android
Can we retrieve data back from Google Drive API in Android?;android
Why won't CustomTabsClient.bindCustomTabsService work?;android
Android Motion Layout - Observe End of transition;android
Activity has leaked window DecorView while using alertDialog;android
Choosing between HLS or MPEG-DASH for a video app;android
Flutter - Android Studio - won't recognize the url_launcher import properly;android
Glide errors on some urls;android
How do i solve : Expected BEGIN_OBJECT but was BEGIN_ARRAY at line 1 column 2 path $ Where response is a retrofit Response in Kotlin [duplicate];android
AppAuth-Android strange problem in handling NOT hierarchical URI callback intent;android
Local Video Not Shown on first time in react-native-agora IOS but work for react native android;android
Android SeekBar Discrete as in the picture;android
NativeScript duplicate android libraries with different versions;android
Can't access the data in JSON with Android Retrofit;android
RecyclerView duplicates data multiple times;android
How to get background color in MaterialButton in kotlin android;android
Room database setup in Android Library module;android
Html.fromHtml hide text between “(” and “)”;android
Unable to change the value of a variable of my fragment from an external class;android
Firebase analytics data collection: log messages;android
Android Kotlin Show detailed information of a clicked item of a recyclerview in a popup dialog;android
Batch file open cmd and execute adb connect 192.168.43.1:5555;android
how to resolve app has stopped in android studio simulator (fragment pager adapter);android
Application doesnt start on some devices, even when there is no error;android
Amazon AWSAppSyncClient error: Execution timeout;android
Resources$NotFoundException on Android 10 devices;android
Android Kotlin Show detailed information of a clicked item of a recyclerview in a popup dialog;android
Gradient has no stop info, when I upload vector asset in AndroidStudio;android
How to update recyclerView list due to variable value kotlin?;android
Using Firebase Libraries in a Dynamic Feature Module;android
What does this means in Logbook?;android
What does this means in Logbook?;android
ERROR : ResourcesNotFoundException during activity layout inflation;android
How to animate images in android in a loop?;android
Gradle build process is failing;android
Question on Firebase Authentication SHA1 for Android [duplicate];android
